id,treat,code_pay,role,group,hidden_number,report1,report2,report3,duplicate,id_play,ip_address,start_time,correct,chosen_card,observed,belief1,belief2,belief3,belief_observed,payoff,gender,ethnicity,race,age,education,state,income,q1,q2,q3,correct_belief,realdata
77,5,x1xfkjim4h4bx3ka,3,2268325067,12,12,12,30,1,2,68.41.210.160,2018-08-18 13:49:19.453380+00:00,Passed,,Unobserved,12,12,,,30,Male,Non hispanic,White,28,High school or equivalent,22,"$40,000 - $49,999",pick the highest number possible to make the most money for yourself,4,nothing comes to mind,1,1
78,5,4j1m95yh4h4bx3ka,3,7285394057,6,6,6,6,1,1,96.230.93.113,2018-08-18 13:07:02.304596+00:00,Passed,,Observed,,6,,,6,Male,Non hispanic,Black/African American,35,Masters degree,21,"$30,000 - $39,999",A study of cooperative behavior,3,Some more rounds would have been nice.,1,1
79,5,3p5wzhu68csu5k6d,3,1446436501,8,30,30,30,1,1,73.251.140.134,2018-08-18 21:00:28.379025+00:00,Passed,,Unobserved,30,30,,,30,Female,Non hispanic,White,35,Some college,46,"$60,000 - $69,999",STRATEGICALLY GET PLAYER 3 TO REPORT A NUMBER SO YOU CAN MAKE THE MOST MONEY AS POSSIBLE.,2,VERY FUN SURVEY!  THANK YOU.,1,1
80,5,65hbpuh88csu5k6d,3,5053447158,7,30,30,30,2,2,107.12.251.52,2018-08-18 21:02:54.779370+00:00,Passed,,Unobserved,10,30,,,30,Female,Non hispanic,Hispanic/Latino/Latina,27,College diploma,33,"< $10,000",Probably communicating with others and being honest to receive a bonus.,4,Nothing. It was a great experience.,1,1
81,5,6suhda5t8csu5k6d,3,6242701602,11,11,11,20,1,8,71.80.193.143,2018-08-18 22:32:11.713071+00:00,Passed,,Observed,,11,,,20,Male,Non hispanic,White,48,College diploma,47,"$60,000 - $69,999",complicated,4,I'm not sure.,1,1
82,5,om5g9ipu8csu5k6d,3,7569427615,11,11,11,11,2,7,71.51.89.213,2018-08-18 22:22:07.437391+00:00,Passed,,Observed,,11,,,11,Female,Non hispanic,White,33,College diploma,10,"$70,000 - $79,999",see if people lied,3,NA,1,1
83,5,sv55fg6t29ywrs1w,3,7935492887,11,11,11,11,2,2,68.11.201.213,2018-08-19 15:46:00.121663+00:00,Passed,,Observed,,11,,,11,Male,Non hispanic,Hispanic/Latino/Latina,27,College diploma,18,"$30,000 - $39,999",To correctly pass on the message to P3.,4,Alter the game to make it an incentive to not correctly report the number.,1,1
